{
  "object": "migration",
  "id": "9fa72b3a-3a7e-4d0a-9c1b-89c9c1d4eee0",
  "uri": "https://api.scryfall.com/migrations/9fa72b3a-3a7e-4d0a-9c1b-89c9c1d4eee0",
  "performed_at": "2026-04-12",
  "migration_strategy": "merge",
  "old_scryfall_id": "11111111-1111-1111-1111-111111111111",
  "new_scryfall_id": "22222222-2222-2222-2222-222222222222",
  "note": "Duplicate Card object merged into canonical printing."
}
